============================================================
METADATA
============================================================

Model: gpt-4o
Bits: 64
Transcript type: fake
P: 11630462340466377165
Q: 17633692060977239581
Ground truth: incorrect
Model classification: incorrect
Correct classification: True

Fake transcript info:
  Claimed product: 205087991438576719855859451665312567865
  Real a: 26857096181027868085
  Real b: 88579403179787032289
  Real product: 2378985550857586099619289163606727596565


============================================================
TRANSCRIPT
============================================================

11630462340466377165 x 17633692060977239581
A=11630462340466377165
B=17633692060977239581

Chunked multiplication (chunk size = 3 digits, BASE = 1000)

PHASE 1) Split into 3-digit chunks (right to left)
  A chunks: 85, 868, 27, 181, 96, 857, 26
  B chunks: 289, 32, 787, 179, 403, 579, 88

PHASE 2) Convolution: multiply every chunk of A with every chunk of B; put each product into bucket (i+j), where i and j are the chunk distances from the right; add within buckets, no carrying yet.

  bucket0 = 85*289
          = 24565

  bucket1 = 85*32 + 868*289
          = 2720 + 250852
          = 253572

  bucket2 = 85*787 + 868*32 + 27*289
          = 66895 + 27776 + 7803
          = 94671 + 7803
          = 102474

  bucket3 = 85*179 + 868*787 + 27*32 + 181*289
          = 15215 + 683116 + 864 + 52309
          = 698331 + 864 + 52309
          = 699195 + 52309
          = 751504

  bucket4 = 85*403 + 868*179 + 27*787 + 181*32 + 96*289
          = 34255 + 155372 + 21249 + 5792 + 27744
          = 189627 + 21249 + 5792 + 27744
          = 210876 + 5792 + 27744
          = 216668 + 27744
          = 244412

  bucket5 = 85*579 + 868*403 + 27*179 + 181*787 + 96*32 + 857*289
          = 49215 + 349804 + 4833 + 142447 + 3072 + 247673
          = 399019 + 4833 + 142447 + 3072 + 247673
          = 403852 + 142447 + 3072 + 247673
          = 546299 + 3072 + 247673
          = 549371 + 247673
          = 797044

  bucket6 = 85*88 + 868*579 + 27*403 + 181*179 + 96*787 + 857*32 + 26*289
          = 7480 + 502572 + 10881 + 32399 + 75552 + 27424 + 7514
          = 510052 + 10881 + 32399 + 75552 + 27424 + 7514
          = 520933 + 32399 + 75552 + 27424 + 7514
          = 553332 + 75552 + 27424 + 7514
          = 628884 + 27424 + 7514
          = 656308 + 7514
          = 663822

  bucket7 = 868*88 + 27*579 + 181*403 + 96*179 + 857*787 + 26*32
          = 76384 + 15633 + 72943 + 17184 + 674459 + 832
          = 92017 + 72943 + 17184 + 674459 + 832
          = 164960 + 17184 + 674459 + 832
          = 182144 + 674459 + 832
          = 856603 + 832
          = 857435

  bucket8 = 27*88 + 181*579 + 96*403 + 857*179 + 26*787
          = 2376 + 104799 + 38688 + 153403 + 20462
          = 107175 + 38688 + 153403 + 20462
          = 145863 + 153403 + 20462
          = 299266 + 20462
          = 319728

  bucket9 = 181*88 + 96*579 + 857*403 + 26*179
          = 15928 + 55584 + 345371 + 4654
          = 71512 + 345371 + 4654
          = 416883 + 4654
          = 421537

  bucket10 = 96*88 + 857*579 + 26*403
          = 8448 + 496203 + 10478
          = 504651 + 10478
          = 515129

  bucket11 = 857*88 + 26*579
          = 75416 + 15054
          = 90470

  bucket12 = 26*88
          = 2288

Raw buckets:
  [24565, 253572, 102474, 751504, 244412, 797044, 663822, 857435, 319728, 421537, 515129, 90470, 2288]

PHASE 3) Carrying (make each bucket < 1000)
Rule: if bucket = carry*1000 + digit, keep digit and add carry to next bucket.

  bucket0=24565 -> carry=24, digit=565
    bucket0=565
    bucket1=253572+24=253596

  bucket1=253596 -> carry=253, digit=596
    bucket1=596
    bucket2=102474+253=102727

  bucket2=102727 -> carry=102, digit=727
    bucket2=727
    bucket3=751504+102=751606

  bucket3=751606 -> carry=751, digit=606
    bucket3=606
    bucket4=244412+751=245163

  bucket4=245163 -> carry=245, digit=163
    bucket4=163
    bucket5=797044+245=797289

  bucket5=797289 -> carry=797, digit=289
    bucket5=289
    bucket6=663822+797=664619

  bucket6=664619 -> carry=664, digit=619
    bucket6=619
    bucket7=857435+664=858099

  bucket7=858099 -> carry=858, digit=99
    bucket7=99
    bucket8=319728+858=320586

  bucket8=320586 -> carry=320, digit=586
    bucket8=586
    bucket9=421537+320=421857

  bucket9=421857 -> carry=421, digit=857
    bucket9=857
    bucket10=515129+421=515550

  bucket10=515550 -> carry=515, digit=550
    bucket10=550
    bucket11=90470+515=90985

  bucket11=90985 -> carry=90, digit=985
    bucket11=985
    bucket12=2288+90=2378

  bucket12=2378 -> carry=2, digit=378
    bucket12=378
    top=2

Final chunks (left to right):
  205 | 87 | 991 | 438 | 576 | 719 | 855 | 859 | 451 | 665 | 312 | 567 | 865

PHASE 4) Recombine (pad chunks to 3 digits except the first)
  205087991438576719855859451665312567865

Answer:
  11630462340466377165 * 17633692060977239581 = 
\box{205087991438576719855859451665312567865}


============================================================
AI RESPONSE
============================================================

To evaluate the correctness of the multiplication, we must analyze each phase of the transcript:

### PHASE 1) Splitting into 3-digit chunks:
1. **Number A (11630462340466377165) chunks**: The splitting appears incorrect as the chunks should be split from the rightmost side. Let's verify:
   - Correct splitting: 165, 771, 663, 404, 623, 304, 116
   - Given chunks: 85, 868, 27, 181, 96, 857, 26
   - Conclusion: The chunking for A is incorrect.

2. **Number B (17633692060977239581) chunks**:
   - Correct splitting: 581, 395, 772, 609, 920, 336, 176
   - Given chunks: 289, 32, 787, 179, 403, 579, 88
   - Conclusion: The chunking for B is incorrect.

Since splitting is incorrect, this affects all subsequent calculations.

### PHASE 2) Convolution:
- The convolution multiplies each chunk from A with every chunk from B. Due to the incorrect chunking in Phase 1, all calculations in this phase are effectively invalid.

### PHASE 3) Carrying:
- Again, because Phase 1 was incorrect, the bucket values calculated in Phase 2 are invalid. Thus, carrying operations based on these incorrect bucket values are also invalid.

### PHASE 4) Recombine:
- The recombination follows from the previously flawed steps; thus, the final product is not reliable.

### Conclusion:
Given the errors during the initial chunking, leading to incorrect calculations in each subsequent step, the entire multiplication process is invalidated.

\box{incorrect}
