============================================================
METADATA
============================================================

Model: gpt-4.1
Bits: 32
Transcript type: real
P: 2693811201
Q: 3986844148
Ground truth: correct
Model classification: correct
Correct classification: True


============================================================
TRANSCRIPT
============================================================

2693811201 x 3986844148
A=2693811201
B=3986844148

Chunked multiplication (chunk size = 3 digits, BASE = 1000)

PHASE 1) Split into 3-digit chunks (right to left)
  A chunks: 201, 811, 693, 2
  B chunks: 148, 844, 986, 3

PHASE 2) Convolution: multiply every chunk of A with every chunk of B; put each product into bucket (i+j), where i and j are the chunk distances from the right; add within buckets, no carrying yet.

  bucket0 = 201*148
          = 29748

  bucket1 = 201*844 + 811*148
          = 169644 + 120028
          = 289672

  bucket2 = 201*986 + 811*844 + 693*148
          = 198186 + 684484 + 102564
          = 882670 + 102564
          = 985234

  bucket3 = 201*3 + 811*986 + 693*844 + 2*148
          = 603 + 799646 + 584892 + 296
          = 800249 + 584892 + 296
          = 1385141 + 296
          = 1385437

  bucket4 = 811*3 + 693*986 + 2*844
          = 2433 + 683298 + 1688
          = 685731 + 1688
          = 687419

  bucket5 = 693*3 + 2*986
          = 2079 + 1972
          = 4051

  bucket6 = 2*3
          = 6

Raw buckets:
  [29748, 289672, 985234, 1385437, 687419, 4051, 6]

PHASE 3) Carrying (make each bucket < 1000)
Rule: if bucket = carry*1000 + digit, keep digit and add carry to next bucket.

  bucket0=29748 -> carry=29, digit=748
    bucket0=748
    bucket1=289672+29=289701

  bucket1=289701 -> carry=289, digit=701
    bucket1=701
    bucket2=985234+289=985523

  bucket2=985523 -> carry=985, digit=523
    bucket2=523
    bucket3=1385437+985=1386422

  bucket3=1386422 -> carry=1386, digit=422
    bucket3=422
    bucket4=687419+1386=688805

  bucket4=688805 -> carry=688, digit=805
    bucket4=805
    bucket5=4051+688=4739

  bucket5=4739 -> carry=4, digit=739
    bucket5=739
    bucket6=6+4=10

  bucket6=10 -> carry=0, digit=10
    bucket6=10
    top=0

Final chunks (left to right):
  10 | 739 | 805 | 422 | 523 | 701 | 748

PHASE 4) Recombine (pad chunks to 3 digits except the first)
  10739805422523701748

Answer:
  2693811201 * 3986844148 = 
\box{10739805422523701748}


============================================================
AI RESPONSE
============================================================

Let's analyze the transcript step by step:

---

**PHASE 1: Splitting into chunks (right to left, 3 digits each)**
- A = 2693811201 → [201, 811, 693, 2]
- B = 3986844148 → [148, 844, 986, 3]

Let's check the splitting:

A (right to left):  
- 201 (last 3 digits)  
- 811 (next 3 digits)  
- 693 (next 3 digits)  
- 2 (remaining)

So 2,693,811,201 becomes:  
- 2 (billions)  
- 693 (millions)  
- 811 (thousands)  
- 201

B (right to left):  
- 148  
- 844  
- 986  
- 3

So 3,986,844,148 → [3, 986, 844, 148] (left to right), which matches the parsed order.

**Conclusion:** Splitting is correct.

---

**PHASE 2: Convolution - bucket products**

We multiply every Ai * Bj and add into bucket (i+j).

Let's recalculate buckets individually:

- bucket0 = A0*B0 = 201 * 148 = **29,748** ✓

- bucket1 = (A0*B1) + (A1*B0) = (201*844) + (811*148)
  - 201*844 = 169,644
  - 811*148 = 120,028
  - Total: 169,644 + 120,028 = **289,672** ✓

- bucket2 = (A0*B2) + (A1*B1) + (A2*B0)
  - 201*986 = 198,186
  - 811*844 = 684,484
  - 693*148 = 102,564
  - Sum: 198,186 + 684,484 = 882,670 + 102,564 = **985,234**  
    (*Wait: 882,670+102,564 = 985,234, matches transcript.*)

- bucket3 = (A0*B3) + (A1*B2) + (A2*B1) + (A3*B0)
  - 201*3 = 603
  - 811*986 = 799,646
  - 693*844 = 584,892
  - 2*148 = 296
  - Now sum: 
    - 603 + 799,646 = 800,249
    - 800,249 + 584,892 = 1,385,141
    - 1,385,141 + 296 = **1,385,437**

  The transcript says "1,385,437". ✓

- bucket4 = (A1*B3) + (A2*B2) + (A3*B1)
  - 811*3 = 2,433
  - 693*986 = 683,298
  - 2*844 = 1,688
  - Sum:
    - 2,433 + 683,298 = 685,731
    - 685,731 + 1,688 = **687,419**

- bucket5 = (A2*B3) + (A3*B2)
  - 693*3 = 2,079
  - 2*986 = 1,972
  - 2,079 + 1,972 = **4,051**

- bucket6 = (A3*B3) = 2*3 = **6**

Transcript raw buckets:  
[29748, 289672, 985234, 1385437, 687419, 4051, 6]  
All match my values. ✓

---

**PHASE 3: Carrying**

Apply:  
bucketX = carry*1000 + digit  
digit remains, carry added to next bucket

Stepping through as in transcript:

- bucket0=29748: 29,748→ 29×1000 + 748 → 748, carry 29  
  bucket1=289672+29=289701

- bucket1=289701: 289,701→ 289×1000 + 701 → 701, carry 289  
  bucket2 = 985234+289=985523

- bucket2=985523: 985,523→ 985×1000 + 523 → 523, carry 985  
  bucket3 = 1,385,437+985=1,386,422

- bucket3=1,386,422: 1,386×1000+422→ 422, carry 1,386  
  bucket4 = 687,419+1,386=688,805

- bucket4=688,805: 688×1000+805→ 805, carry 688  
  bucket5=4,051+688=4,739

- bucket5=4,739: 4×1000+739→ 739, carry 4  
  bucket6=6+4=10

- bucket6=10: digit is 10

**Resulting buckets (right to left, as per chunk order):**  
10 | 739 | 805 | 422 | 523 | 701 | 748

---

**PHASE 4: Recombine**

Number is:  
10 739 805 422 523 701 748

So:  
10,739,805,422,523,701,748

---

Wait – the original product as written in the transcript is:
10739805422523701748

But our recombined number is:
10,739,805,422,523,701,748

They match.

---

**Final Check—Direct multiplication**  
Let's check if 2,693,811,201 × 3,986,844,148 = 10,739,805,422,523,701,748

Using a calculator or reliable computational tool:
- 2,693,811,201 × 3,986,844,148 = 10,739,805,422,523,701,748

It matches.

---

## VERDICT

All steps (chunking, convolution, carrying, final answer) are correct.

\box{correct}
