============================================================
METADATA
============================================================

Model: gpt-4.1-nano
Bits: 32
Transcript type: fake
P: 2800299551
Q: 2936192832
Ground truth: incorrect
Model classification: incorrect
Correct classification: True

Fake transcript info:
  Claimed product: 8222219469099018432
  Real a: 4337701348
  Real b: 2431081084
  Real product: 10545303695164101232


============================================================
TRANSCRIPT
============================================================

2800299551 x 2936192832
A=2800299551
B=2936192832

Chunked multiplication (chunk size = 3 digits, BASE = 1000)

PHASE 1) Split into 3-digit chunks (right to left)
  A chunks: 348, 701, 337, 4
  B chunks: 84, 81, 431, 2

PHASE 2) Convolution: multiply every chunk of A with every chunk of B; put each product into bucket (i+j), where i and j are the chunk distances from the right; add within buckets, no carrying yet.

  bucket0 = 348*84
          = 29232

  bucket1 = 348*81 + 701*84
          = 28188 + 58884
          = 87072

  bucket2 = 348*431 + 701*81 + 337*84
          = 149988 + 56781 + 28308
          = 206769 + 28308
          = 235077

  bucket3 = 348*2 + 701*431 + 337*81 + 4*84
          = 696 + 302131 + 27297 + 336
          = 302827 + 27297 + 336
          = 330124 + 336
          = 330460

  bucket4 = 701*2 + 337*431 + 4*81
          = 1402 + 145247 + 324
          = 146649 + 324
          = 146973

  bucket5 = 337*2 + 4*431
          = 674 + 1724
          = 2398

  bucket6 = 4*2
          = 8

Raw buckets:
  [29232, 87072, 235077, 330460, 146973, 2398, 8]

PHASE 3) Carrying (make each bucket < 1000)
Rule: if bucket = carry*1000 + digit, keep digit and add carry to next bucket.

  bucket0=29232 -> carry=29, digit=232
    bucket0=232
    bucket1=87072+29=87101

  bucket1=87101 -> carry=87, digit=101
    bucket1=101
    bucket2=235077+87=235164

  bucket2=235164 -> carry=235, digit=164
    bucket2=164
    bucket3=330460+235=330695

  bucket3=330695 -> carry=330, digit=695
    bucket3=695
    bucket4=146973+330=147303

  bucket4=147303 -> carry=147, digit=303
    bucket4=303
    bucket5=2398+147=2545

  bucket5=2545 -> carry=2, digit=545
    bucket5=545
    bucket6=8+2=10

  bucket6=10 -> carry=0, digit=10
    bucket6=10
    top=0

Final chunks (left to right):
  8 | 222 | 219 | 469 | 99 | 18 | 432

PHASE 4) Recombine (pad chunks to 3 digits except the first)
  8222219469099018432

Answer:
  2800299551 * 2936192832 = 
\box{8222219469099018432}


============================================================
AI RESPONSE
============================================================

Let's analyze the transcript step by step:

**Step 1: Checking the chunking of original numbers**

Original numbers:

A = 2800299551
B = 2936192832

They are split into 3-digit chunks from right to left:

A chunks: 348, 701, 337, 4
B chunks: 84, 81, 431, 2

Let's verify:

A:
2800299551
Splitting into 3-digit chunks from right:

2800299551
From the right: 
551 (positions 0-2)
995 (positions 3-5)
002 (positions 6-8)
028 (positions 9-11)

But they seem to have chunks: 348, 701, 337, 4

This suggests the chunks are:

Looking at the original number A = 2,800,299,551

Let's do the proper splitting:

Number: 2,800,299,551

Digits: 2 8 0 0 2 9 9 5 5 1

From right:

551 -> last 3 digits: 551 -> but the transcript says 348 in the first chunk.

So, the chunks are:

They show A chunks: 348, 701, 337, 4

Number is 2800299551

Check:

- Last 3 digits: 551 (but in the test), they have 348

- Next 3: 299 (but in the test, 701)

- Next 3: 002 (but 337)

- Next 1: 2 (but 4)

This indicates an inconsistency in splitting.

Similarly, check B: 2936192832

Splitting into 3-digit chunks right to left:

Number: 2936192832

Chunks from right:

832, 918, 362, 9

But in the transcript, they show B chunks: 84, 81, 431, 2

Again, inconsistency.

**Conclusion:** The chunking as per the number does not match the chunks used in the transcript. So, the chunk splitting is incorrect.

---

**Step 2: Checking the convolution calculations**

Given the chunks:

A: 348, 701, 337, 4

B: 84, 81, 431, 2

In convolution, each bucket is:

bucket0 = 348*84 = 29232 (correct)

bucket1 = 348*81 + 701*84 = 28188 + 58884 = 87072 (correct)

bucket2 = 348*431 + 701*81 + 337*84 = 149988 + 56781 + 28308 = 235077 (correct sum)

bucket3 = 348*2 + 701*431 + 337*81 + 4*84

Calculate:

348*2 = 696

701*431 = (701*400) + (701*30) + (701*1) = 280400 + 21030 + 701 = 302131

337*81 = (337*80) + (337*1) = 26960 + 337 = 27297

4*84=336

Sum: 696 + 302131 + 27297 + 336 = 330460 (matches provided)

Similarly, other bucket calculations are correct as per their arithmetic.

---

**Step 3: Carrying process**

Carrying steps seem correct:

bucket0=29232 -> carry=29, digit=232

bucket1=87072+29=87101 -> carry=87, digit=101

bucket2=235077+87=235164 -> carry=235, digit=164

bucket3=330695 -> carry=330, digit=695

bucket4=146973+330=147303

bucket5=2398+147=2545 -> carry=2, digit=545

bucket6=8+2=10 -> carry=0, digit=10

Final buckets after carry: 232, 101, 164, 695, 303, 545, 10

---

**Step 4: Recombining chunks**

The final chunks after recombining, as per the transcript, are:

8 | 222 | 219 | 469 | 99 | 18 | 432

which combined to:

8 222 219 469 99 18 432

which results in:

8222219469099018432

---

**Step 5: Comparing the final answer**

The final recombined number is:

8222219469099018432

Is it consistent with the initial chunks and calculations?

Given the questioned chunks: 8 | 222 | 219 | 469 | 99 | 18 | 432

And the buckets and their carry adjustments, the advanced steps are consistent internally with their own work.

**Main concern:**

- The problem lies in the initial chunk splitting: The chunks they used (348, 701, 337, 4) for A and (84, 81, 431, 2) for B do not correspond to the original numbers.

- The original numbers are 2800299551 and 2936192832. When splitting into 3-digit chunks from right, the chunks should be:

A: 551, 299, 800, 2 (or similar if padded), but not 348, 701, 337, 4

- Similarly for B.

This discrepancy indicates that the chunks used are incorrect.

---

**Verdiction:**

While the convolution, carry process, and recombination appear internally consistent, the initial chunking is not correct relative to the original numbers as provided.

**Therefore, the multiplication process, based on the initial number, is incorrect.**

**Final answer: \box{incorrect}**
