============================================================
METADATA
============================================================

Model: gpt-4.1
Bits: 32
Transcript type: real
P: 3427147266
Q: 3401334559
Ground truth: correct
Model classification: correct
Correct classification: True


============================================================
TRANSCRIPT
============================================================

3427147266 x 3401334559
A=3427147266
B=3401334559

Chunked multiplication (chunk size = 3 digits, BASE = 1000)

PHASE 1) Split into 3-digit chunks (right to left)
  A chunks: 266, 147, 427, 3
  B chunks: 559, 334, 401, 3

PHASE 2) Convolution: multiply every chunk of A with every chunk of B; put each product into bucket (i+j), where i and j are the chunk distances from the right; add within buckets, no carrying yet.

  bucket0 = 266*559
          = 148694

  bucket1 = 266*334 + 147*559
          = 88844 + 82173
          = 171017

  bucket2 = 266*401 + 147*334 + 427*559
          = 106666 + 49098 + 238693
          = 155764 + 238693
          = 394457

  bucket3 = 266*3 + 147*401 + 427*334 + 3*559
          = 798 + 58947 + 142618 + 1677
          = 59745 + 142618 + 1677
          = 202363 + 1677
          = 204040

  bucket4 = 147*3 + 427*401 + 3*334
          = 441 + 171227 + 1002
          = 171668 + 1002
          = 172670

  bucket5 = 427*3 + 3*401
          = 1281 + 1203
          = 2484

  bucket6 = 3*3
          = 9

Raw buckets:
  [148694, 171017, 394457, 204040, 172670, 2484, 9]

PHASE 3) Carrying (make each bucket < 1000)
Rule: if bucket = carry*1000 + digit, keep digit and add carry to next bucket.

  bucket0=148694 -> carry=148, digit=694
    bucket0=694
    bucket1=171017+148=171165

  bucket1=171165 -> carry=171, digit=165
    bucket1=165
    bucket2=394457+171=394628

  bucket2=394628 -> carry=394, digit=628
    bucket2=628
    bucket3=204040+394=204434

  bucket3=204434 -> carry=204, digit=434
    bucket3=434
    bucket4=172670+204=172874

  bucket4=172874 -> carry=172, digit=874
    bucket4=874
    bucket5=2484+172=2656

  bucket5=2656 -> carry=2, digit=656
    bucket5=656
    bucket6=9+2=11

  bucket6=11 -> carry=0, digit=11
    bucket6=11
    top=0

Final chunks (left to right):
  11 | 656 | 874 | 434 | 628 | 165 | 694

PHASE 4) Recombine (pad chunks to 3 digits except the first)
  11656874434628165694

Answer:
  3427147266 * 3401334559 = 
\box{11656874434628165694}


============================================================
AI RESPONSE
============================================================

Let's analyze the multiplication transcript step by step.

---

### PHASE 1: Splitting into Chunks

- A = 3427147266 → split into 3-digit chunks (right to left): **266, 147, 427, 3**
- B = 3401334559 → split into 3-digit chunks: **559, 334, 401, 3**

First, let's verify the number splits:
- 3427147266: 3 | 427 | 147 | 266 ⇒ 3,427,147,266 (correct)
- 3401334559: 3 | 401 | 334 | 559 ⇒ 3,401,334,559 (correct)

**Chunk splits are correct.**

---

### PHASE 2: Bucket Calculation (Convolution)

We need to check each bucket's calculation.

#### bucket0 = 266 * 559
= 148,694 ✔

#### bucket1 = 266*334 + 147*559
266*334 = 88,844
147*559 = 82,173
Sum: 88,844 + 82,173 = 171,017 ✔

#### bucket2 = 266*401 + 147*334 + 427*559
266*401 = 106,666  
147*334 = 49,098  
427*559 = 238,693

Adding: 106,666 + 49,098 = 155,764  
155,764 + 238,693 = 394,457 ✔

#### bucket3 = 266*3 + 147*401 + 427*334 + 3*559
266*3 = 798
147*401 = 58,947
427*334 = 142,618
3*559 = 1,677

Adding: 798 + 58,947 = 59,745  
59,745 + 142,618 = 202,363  
202,363 + 1,677 = 204,040 ✔

#### bucket4 = 147*3 + 427*401 + 3*334
147*3 = 441  
427*401 = 171,227  
3*334 = 1,002  
Adding: 441 + 171,227 = 171,668  
171,668 + 1,002 = 172,670 ✔

#### bucket5 = 427*3 + 3*401
427*3 = 1,281  
3*401 = 1,203  
1,281 + 1,203 = 2,484 ✔

#### bucket6 = 3*3 = 9 ✔

**Bucket (convolution) calculations are correct.**

Raw buckets: [148694, 171017, 394457, 204040, 172670, 2484, 9]

---

### PHASE 3: Carrying

Each bucket should be reduced modulo 1000, with the quotient added to the next bucket.

#### bucket0=148694 → 148 * 1000 + 694 → carry=148, digit=694
bucket0=694, add 148 to bucket1: 171017 + 148 = 171165

#### bucket1=171165 → 171 * 1000 + 165 → carry=171, digit=165
bucket1=165, add 171 to bucket2: 394457 + 171 = 394628

#### bucket2=394628 → 394 * 1000 + 628 → carry=394, digit=628
bucket2=628, add 394 to bucket3: 204040 + 394 = 204434

#### bucket3=204434 → 204 * 1000 + 434 → carry=204, digit=434
bucket3=434, add 204 to bucket4: 172670 + 204 = 172874

#### bucket4=172874 → 172 * 1000 + 874 → carry=172, digit=874
bucket4=874, add 172 to bucket5: 2484 + 172 = 2656

#### bucket5=2656 → 2 * 1000 + 656 → carry=2, digit=656
bucket5=656, add 2 to bucket6: 9 + 2 = 11

#### bucket6=11 → 0 * 1000 + 11 → carry=0, digit=11
bucket6=11, top=0

**Carrying is correct. Step by step, everything checks out.**

Final chunks (left to right): 11 | 656 | 874 | 434 | 628 | 165 | 694

---

### PHASE 4: Recombine

Pad all but the first chunk to 3 digits, stick together:
- 11 (left, possibly fewer than 3 digits)
- 656, 874, 434, 628, 165, 694 (all 3 digits)

So, the final number is: 11 656 874 434 628 165 694

Or: 11656874434628165694

---

## Final Verification

Compute the product manually or via calculation:

3427147266 × 3401334559 = 11656874434628165694

**This matches the computed result!**

---

## VERDICT

\box{correct}

**Reason:** Every phase was executed correctly — chunking, convolution, carrying, and recombination — and the answer matches standard multiplication.
