============================================================
METADATA
============================================================

Model: gpt-4.1-nano
Bits: 32
Transcript type: real
P: 2599932133
Q: 2951659810
Ground truth: correct
Model classification: 7674115185703674730
Correct classification: False


============================================================
TRANSCRIPT
============================================================

2599932133 x 2951659810
A=2599932133
B=2951659810

Chunked multiplication (chunk size = 3 digits, BASE = 1000)

PHASE 1) Split into 3-digit chunks (right to left)
  A chunks: 133, 932, 599, 2
  B chunks: 810, 659, 951, 2

PHASE 2) Convolution: multiply every chunk of A with every chunk of B; put each product into bucket (i+j), where i and j are the chunk distances from the right; add within buckets, no carrying yet.

  bucket0 = 133*810
          = 107730

  bucket1 = 133*659 + 932*810
          = 87647 + 754920
          = 842567

  bucket2 = 133*951 + 932*659 + 599*810
          = 126483 + 614188 + 485190
          = 740671 + 485190
          = 1225861

  bucket3 = 133*2 + 932*951 + 599*659 + 2*810
          = 266 + 886332 + 394741 + 1620
          = 886598 + 394741 + 1620
          = 1281339 + 1620
          = 1282959

  bucket4 = 932*2 + 599*951 + 2*659
          = 1864 + 569649 + 1318
          = 571513 + 1318
          = 572831

  bucket5 = 599*2 + 2*951
          = 1198 + 1902
          = 3100

  bucket6 = 2*2
          = 4

Raw buckets:
  [107730, 842567, 1225861, 1282959, 572831, 3100, 4]

PHASE 3) Carrying (make each bucket < 1000)
Rule: if bucket = carry*1000 + digit, keep digit and add carry to next bucket.

  bucket0=107730 -> carry=107, digit=730
    bucket0=730
    bucket1=842567+107=842674

  bucket1=842674 -> carry=842, digit=674
    bucket1=674
    bucket2=1225861+842=1226703

  bucket2=1226703 -> carry=1226, digit=703
    bucket2=703
    bucket3=1282959+1226=1284185

  bucket3=1284185 -> carry=1284, digit=185
    bucket3=185
    bucket4=572831+1284=574115

  bucket4=574115 -> carry=574, digit=115
    bucket4=115
    bucket5=3100+574=3674

  bucket5=3674 -> carry=3, digit=674
    bucket5=674
    bucket6=4+3=7

  bucket6=7 -> carry=0, digit=7
    bucket6=7
    top=0

Final chunks (left to right):
  7 | 674 | 115 | 185 | 703 | 674 | 730

PHASE 4) Recombine (pad chunks to 3 digits except the first)
  7674115185703674730

Answer:
  2599932133 * 2951659810 = 
\box{7674115185703674730}


============================================================
AI RESPONSE
============================================================

Let's analyze the transcript step by step.

**Step 1: Are the chunks split correctly?**

- A = 2599932133
- B = 2951659810

Splitting into 3-digit chunks from right to left:

- A: 2599932133
  From right: 133, 932, 599, 2
  Correct, since:
  2599932133 = 2,599,932,133
  Chunks: 133, 932, 599, 2

- B: 2951659810
  From right: 810, 659, 951, 2
  Correct, since:
  2951659810 = 2,951,659,810
  Chunks: 810, 659, 951, 2

**Chunks split correctly.**

---

**Step 2: Check the convolution / bucket calculations**

Compute each bucket:

- bucket0: 133 * 810 = 107,730 ✓
- bucket1: 133*659 + 932*810
  = 87,647 + 754,920 = 842,567 ✓
- bucket2: 133*951 + 932*659 + 599*810
  = 126,483 + 614,188 + 485,190 = 1,225,861 ✓
- bucket3: 133*2 + 932*951 + 599*659 + 2*810
  = 266 + 886,332 + 394,741 + 1,620
  Sum: 886,332 + 394,741 = 1,281,073
  1,281,073 + 266 + 1,620 = 1,281,073 + 1,886 = 1,282,959

But the transcript shows:

> bucket3 = 266 + 886,332 + 394,741 + 1,620 = 886,598 + 394,741 + 1,620 = 1,281,339

Wait, here is a discrepancy:

- The sum of 266 + 886,332 + 394,741 + 1,620 should be:

266 + 886,332 = 886,598  
886,598 + 394,741 = 1,281,339  
1,281,339 + 1,620 = 1,282,959

The transcript's calculation:

> 886,598 + 394,741 + 1,620 = 1,282,959

It seems in explanation they wrote:

> 886,598 + 394,741 + 1,620 = 1,281,339

which is an error in their summation step. The total should be 1,282,959, matching the initial calculation.

Their initial sum (before adding 266) was 886,598, so total should be:

266 + 886,598 + 394,741 + 1,620 = 

266 + 886,598 = 886,864

886,864 + 394,741 = 1,281,605

1,281,605 + 1,620 = 1,283,225

But this conflicts with the previous sum.

Actually, here's the correct step-by-step:

- 133*2 = 266
- 932*951 = ?

Let's double check 932*951:

932 * 951:

Actually, from the problem:

> 932*951 = 886,332 

The multiplication is correct as per the initial calculation.

Summing:

266 + 886,332 + 394,741 + 1,620

Now sum:

266 + 886,332 = 886,598

886,598 + 394,741 = 1,281,339

1,281,339 + 1,620 = 1,282,959

So total for bucket3: **1,282,959**, matching our calculation.

The transcript's earlier text says:

> bucket3 = 266 + 886332 + 394741 + 1620 = 886598 + 394741 + 1620 = 1281339 + 1620 = 1282959

which aligns with our final total.

In the transcript, they mentioned "1281339 + 1620", which matches the previous sum: 1,281,339 + 1,620 = 1,282,959.

So the bucket3 value they have in the raw buckets is:

> bucket3 = 1,282,959

which matches their final calculation.

**Note:** The initial listing in "raw buckets" shows 1,282,959 as well.

- bucket4: 932*2 + 599*951 + 2*659
  = 1,864 + 569,649 + 1,318 = 572,831 ✓
- bucket5: 599*2 + 2*951
  = 1,198 + 1,902 = 3,100 ✓
- bucket6: 2 * 2 = 4 ✓

The raw buckets array: [107,730, 842,567, 1,225,861, 1,282,959, 572,831, 3,100, 4]

**Therefore, the bucket calculations are correct.**

---

**Step 3: Carrying steps**

Carry each bucket to make all <1000:

1. bucket0 = 107,730
   carry = 107
   bucket0 digit = 730
   bucket1 += 107 → 842,567 + 107 = 842,674

2. bucket1 = 842,674
   carry = 842
   digit = 674
   bucket2 += 842 → 1,225,861 + 842 = 1,226,703

3. bucket2 = 1,226,703
   carry = 1,226
   digit = 703
   bucket3 += 1,226 → 1,282,959 + 1,226 = 1,284,185

4. bucket3 = 1,284,185
   carry = 1,284
   digit = 185
   bucket4 += 1,284 → 572,831 + 1,284 = 574,115

5. bucket4 = 574,115
   carry = 574
   digit = 115
   bucket5 += 574 → 3,100 + 574 = 3,674

6. bucket5 = 3,674
   carry= 3
   digit= 674
   bucket6 += 3 → 4 + 3= 7

7. bucket6=7
   carry=0
   digit=7

Final buckets after carrying:
730, 674, 703, 185, 115, 674, 7

---

**Step 4: Recombine into final number**

Seemingly they padded to 3 digits (except the first) and concatenated:

> 7 | 674 | 115 | 185 | 703 | 674 | 730

Final number:

7674115185703674730

**Compare this with the final answer provided:**

> \boxed{7674115185703674730}

which matches exactly.

---

**Final verification:**

- The splitting of chunks is correct.
- The bucket calculations are correct, considering their products.
- The convolution sums and their summations are correct.
- The carrying process is properly executed.
- The recombined number matches the expected final number.

**Conclusion:**

All steps are consistent and correct. There are no errors in the multiplications, summations, carries, or final recombination.

**Final verdict:**

\(\boxed{\text{correct}}\)
