============================================================
METADATA
============================================================

Model: gpt-4o-mini
Bits: 64
Transcript type: real
P: 9355842104128655551
Q: 15606851929382382254
Ground truth: correct
Model classification: correct
Correct classification: True


============================================================
TRANSCRIPT
============================================================

9355842104128655551 x 15606851929382382254
A=9355842104128655551
B=15606851929382382254

Chunked multiplication (chunk size = 3 digits, BASE = 1000)

PHASE 1) Split into 3-digit chunks (right to left)
  A chunks: 551, 655, 128, 104, 842, 355, 9
  B chunks: 254, 382, 382, 929, 851, 606, 15

PHASE 2) Convolution: multiply every chunk of A with every chunk of B; put each product into bucket (i+j), where i and j are the chunk distances from the right; add within buckets, no carrying yet.

  bucket0 = 551*254
          = 139954

  bucket1 = 551*382 + 655*254
          = 210482 + 166370
          = 376852

  bucket2 = 551*382 + 655*382 + 128*254
          = 210482 + 250210 + 32512
          = 460692 + 32512
          = 493204

  bucket3 = 551*929 + 655*382 + 128*382 + 104*254
          = 511879 + 250210 + 48896 + 26416
          = 762089 + 48896 + 26416
          = 810985 + 26416
          = 837401

  bucket4 = 551*851 + 655*929 + 128*382 + 104*382 + 842*254
          = 468901 + 608495 + 48896 + 39728 + 213868
          = 1077396 + 48896 + 39728 + 213868
          = 1126292 + 39728 + 213868
          = 1166020 + 213868
          = 1379888

  bucket5 = 551*606 + 655*851 + 128*929 + 104*382 + 842*382 + 355*254
          = 333906 + 557405 + 118912 + 39728 + 321644 + 90170
          = 891311 + 118912 + 39728 + 321644 + 90170
          = 1010223 + 39728 + 321644 + 90170
          = 1049951 + 321644 + 90170
          = 1371595 + 90170
          = 1461765

  bucket6 = 551*15 + 655*606 + 128*851 + 104*929 + 842*382 + 355*382 + 9*254
          = 8265 + 396930 + 108928 + 96616 + 321644 + 135610 + 2286
          = 405195 + 108928 + 96616 + 321644 + 135610 + 2286
          = 514123 + 96616 + 321644 + 135610 + 2286
          = 610739 + 321644 + 135610 + 2286
          = 932383 + 135610 + 2286
          = 1067993 + 2286
          = 1070279

  bucket7 = 655*15 + 128*606 + 104*851 + 842*929 + 355*382 + 9*382
          = 9825 + 77568 + 88504 + 782218 + 135610 + 3438
          = 87393 + 88504 + 782218 + 135610 + 3438
          = 175897 + 782218 + 135610 + 3438
          = 958115 + 135610 + 3438
          = 1093725 + 3438
          = 1097163

  bucket8 = 128*15 + 104*606 + 842*851 + 355*929 + 9*382
          = 1920 + 63024 + 716542 + 329795 + 3438
          = 64944 + 716542 + 329795 + 3438
          = 781486 + 329795 + 3438
          = 1111281 + 3438
          = 1114719

  bucket9 = 104*15 + 842*606 + 355*851 + 9*929
          = 1560 + 510252 + 302105 + 8361
          = 511812 + 302105 + 8361
          = 813917 + 8361
          = 822278

  bucket10 = 842*15 + 355*606 + 9*851
          = 12630 + 215130 + 7659
          = 227760 + 7659
          = 235419

  bucket11 = 355*15 + 9*606
          = 5325 + 5454
          = 10779

  bucket12 = 9*15
          = 135

Raw buckets:
  [139954, 376852, 493204, 837401, 1379888, 1461765, 1070279, 1097163, 1114719, 822278, 235419, 10779, 135]

PHASE 3) Carrying (make each bucket < 1000)
Rule: if bucket = carry*1000 + digit, keep digit and add carry to next bucket.

  bucket0=139954 -> carry=139, digit=954
    bucket0=954
    bucket1=376852+139=376991

  bucket1=376991 -> carry=376, digit=991
    bucket1=991
    bucket2=493204+376=493580

  bucket2=493580 -> carry=493, digit=580
    bucket2=580
    bucket3=837401+493=837894

  bucket3=837894 -> carry=837, digit=894
    bucket3=894
    bucket4=1379888+837=1380725

  bucket4=1380725 -> carry=1380, digit=725
    bucket4=725
    bucket5=1461765+1380=1463145

  bucket5=1463145 -> carry=1463, digit=145
    bucket5=145
    bucket6=1070279+1463=1071742

  bucket6=1071742 -> carry=1071, digit=742
    bucket6=742
    bucket7=1097163+1071=1098234

  bucket7=1098234 -> carry=1098, digit=234
    bucket7=234
    bucket8=1114719+1098=1115817

  bucket8=1115817 -> carry=1115, digit=817
    bucket8=817
    bucket9=822278+1115=823393

  bucket9=823393 -> carry=823, digit=393
    bucket9=393
    bucket10=235419+823=236242

  bucket10=236242 -> carry=236, digit=242
    bucket10=242
    bucket11=10779+236=11015

  bucket11=11015 -> carry=11, digit=15
    bucket11=15
    bucket12=135+11=146

  bucket12=146 -> carry=0, digit=146
    bucket12=146
    top=0

Final chunks (left to right):
  146 | 15 | 242 | 393 | 817 | 234 | 742 | 145 | 725 | 894 | 580 | 991 | 954

PHASE 4) Recombine (pad chunks to 3 digits except the first)
  146015242393817234742145725894580991954

Answer:
  9355842104128655551 * 15606851929382382254 = 
\box{146015242393817234742145725894580991954}


============================================================
AI RESPONSE
============================================================

To verify the multiplication transcript, we need to analyze each step closely.

### Step 1: Chunk Splitting
**A = 9355842104128655551**  
Split into chunks of 3 digits:  
- A chunks: 551, 655, 128, 104, 842, 355, 9  
**Correct** 

**B = 15606851929382382254**  
Split into chunks of 3 digits:  
- B chunks: 254, 382, 382, 929, 851, 606, 15  
**Correct**

### Step 2: Convolution (Bucket Calculations)
Next, we check the convolution calculations for each bucket.

1. **bucket0**: \( 551 \times 254 = 139954 \)  
**Correct** 

2. **bucket1**: 
   \( 551 \times 382 + 655 \times 254 = 210482 + 166370 = 376852 \)  
**Correct**

3. **bucket2**: 
   \( 551 \times 382 + 655 \times 382 + 128 \times 254 = 210482 + 250210 + 32512 = 493204 \)  
**Correct**

4. **bucket3**: 
   \( 551 \times 929 + 655 \times 382 + 128 \times 382 + 104 \times 254 = 511879 + 250210 + 48896 + 26416 = 837401 \)  
**Correct**

5. **bucket4**: 
   \( 551 \times 851 + 655 \times 929 + 128 \times 382 + 104 \times 382 + 842 \times 254 = 468901 + 608495 + 48896 + 39728 + 213868 = 1379888 \)  
**Correct**

6. **bucket5**: 
   \( 551 \times 606 + 655 \times 851 + 128 \times 929 + 104 \times 382 + 842 \times 382 + 355 \times 254 = 333906 + 557405 + 118912 + 39728 + 321644 + 90170 = 1461765 \)  
**Correct**

7. **bucket6**: 
   \( 551 \times 15 + 655 \times 606 + 128 \times 851 + 104 \times 929 + 842 \times 382 + 355 \times 382 + 9 \times 254 = 8265 + 396930 + 108928 + 96616 + 321644 + 135610 + 2286 = 1070279 \)  
**Correct**

8. **bucket7**: 
   \( 655 \times 15 + 128 \times 606 + 104 \times 851 + 842 \times 929 + 355 \times 382 + 9 \times 382 = 9825 + 77568 + 88504 + 782218 + 135610 + 3438 = 1097163 \)  
**Correct**

9. **bucket8**: 
   \( 128 \times 15 + 104 \times 606 + 842 \times 851 + 355 \times 929 + 9 \times 382 = 1920 + 63024 + 716542 + 329795 + 3438 = 1114719 \)  
**Correct**

10. **bucket9**: 
   \( 104 \times 15 + 842 \times 606 + 355 \times 851 + 9 \times 929 = 1560 + 510252 + 302105 + 8361 = 822278 \)  
**Correct**

11. **bucket10**: 
   \( 842 \times 15 + 355 \times 606 + 9 \times 851 = 12630 + 215130 + 7659 = 235419 \)  
**Correct**

12. **bucket11**: 
   \( 355 \times 15 + 9 \times 606 = 5325 + 5454 = 10779 \)  
**Correct**

13. **bucket12**: 
   \( 9 \times 15 = 135 \)  
**Correct**

### Step 3: Carrying the Buckets
Let's analyze the carrying process step by step:

1. **bucket0**: 139954 → carry = 139, digit = 954 → \( bucket1: 376852 + 139 = 376991 \)  
**Correct**

2. **bucket1**: 376991 → carry = 376, digit = 991 → \( bucket2: 493204 + 376 = 493580 \)  
**Correct**

3. **bucket2**: 493580 → carry = 493, digit = 580 → \( bucket3: 837401 + 493 = 837894 \)  
**Correct**

4. **bucket3**: 837894 → carry = 837, digit = 894 → \( bucket4: 1379888 + 837 = 1380725 \)  
**Correct**

5. **bucket4**: 1380725 → carry = 1380, digit = 725 → \( bucket5: 1461765 + 1380 = 1463145 \)  
**Correct**

6. **bucket5**: 1463145 → carry = 1463, digit = 145 → \( bucket6: 1070279 + 1463 = 1071742 \)  
**Correct**

7. **bucket6**: 1071742 → carry = 1071, digit = 742 → \( bucket7: 1097163 + 1071 = 1098234 \)  
**Correct**

8. **bucket7**: 1098234 → carry = 1098, digit = 234 → \( bucket8: 1114719 + 1098 = 1115817 \)  
**Correct**

9. **bucket8**: 1115817 → carry = 1115, digit = 817 → \( bucket9: 822278 + 1115 = 823393 \)  
**Correct**

10. **bucket9**: 823393 → carry = 823, digit = 393 → \( bucket10: 235419 + 823 = 236242 \)  
**Correct**

11. **bucket10**: 236242 → carry = 236, digit = 242 → \( bucket11: 10779 + 236 = 11015 \)  
**Correct**

12. **bucket11**: 11015 → carry = 11, digit = 15 → \( bucket12: 135 + 11 = 146 \)  
**Correct**

13. **bucket12**: 146 → carry = 0, digit = 146 → top = 0  
**Correct**

### Final Step: Recombine
The final steps produce:
- Final chunks (from bucket values):  
\[ 146 | 15 | 242 | 393 | 817 | 234 | 742 | 145 | 725 | 894 | 580 | 991 | 954 \]
- Combining gives:  
\[ 146015242393817234742145725894580991954 \] 

### Final Verification
The arithmetic checks out at each step, and the recombined number matches the final presented result.

Thus, the verdict on whether the multiplication is performed correctly is:

\(\text{\boxed{correct}}\)
