============================================================
METADATA
============================================================

Model: gpt-4o-mini
Bits: 64
Transcript type: real
P: 16262839261427117426
Q: 11805125464283272300
Ground truth: correct
Model classification: correct
Correct classification: True


============================================================
TRANSCRIPT
============================================================

16262839261427117426 x 11805125464283272300
A=16262839261427117426
B=11805125464283272300

Chunked multiplication (chunk size = 3 digits, BASE = 1000)

PHASE 1) Split into 3-digit chunks (right to left)
  A chunks: 426, 117, 427, 261, 839, 262, 16
  B chunks: 300, 272, 283, 464, 125, 805, 11

PHASE 2) Convolution: multiply every chunk of A with every chunk of B; put each product into bucket (i+j), where i and j are the chunk distances from the right; add within buckets, no carrying yet.

  bucket0 = 426*300
          = 127800

  bucket1 = 426*272 + 117*300
          = 115872 + 35100
          = 150972

  bucket2 = 426*283 + 117*272 + 427*300
          = 120558 + 31824 + 128100
          = 152382 + 128100
          = 280482

  bucket3 = 426*464 + 117*283 + 427*272 + 261*300
          = 197664 + 33111 + 116144 + 78300
          = 230775 + 116144 + 78300
          = 346919 + 78300
          = 425219

  bucket4 = 426*125 + 117*464 + 427*283 + 261*272 + 839*300
          = 53250 + 54288 + 120841 + 70992 + 251700
          = 107538 + 120841 + 70992 + 251700
          = 228379 + 70992 + 251700
          = 299371 + 251700
          = 551071

  bucket5 = 426*805 + 117*125 + 427*464 + 261*283 + 839*272 + 262*300
          = 342930 + 14625 + 198128 + 73863 + 228208 + 78600
          = 357555 + 198128 + 73863 + 228208 + 78600
          = 555683 + 73863 + 228208 + 78600
          = 629546 + 228208 + 78600
          = 857754 + 78600
          = 936354

  bucket6 = 426*11 + 117*805 + 427*125 + 261*464 + 839*283 + 262*272 + 16*300
          = 4686 + 94185 + 53375 + 121104 + 237437 + 71264 + 4800
          = 98871 + 53375 + 121104 + 237437 + 71264 + 4800
          = 152246 + 121104 + 237437 + 71264 + 4800
          = 273350 + 237437 + 71264 + 4800
          = 510787 + 71264 + 4800
          = 582051 + 4800
          = 586851

  bucket7 = 117*11 + 427*805 + 261*125 + 839*464 + 262*283 + 16*272
          = 1287 + 343735 + 32625 + 389296 + 74146 + 4352
          = 345022 + 32625 + 389296 + 74146 + 4352
          = 377647 + 389296 + 74146 + 4352
          = 766943 + 74146 + 4352
          = 841089 + 4352
          = 845441

  bucket8 = 427*11 + 261*805 + 839*125 + 262*464 + 16*283
          = 4697 + 210105 + 104875 + 121568 + 4528
          = 214802 + 104875 + 121568 + 4528
          = 319677 + 121568 + 4528
          = 441245 + 4528
          = 445773

  bucket9 = 261*11 + 839*805 + 262*125 + 16*464
          = 2871 + 675395 + 32750 + 7424
          = 678266 + 32750 + 7424
          = 711016 + 7424
          = 718440

  bucket10 = 839*11 + 262*805 + 16*125
          = 9229 + 210910 + 2000
          = 220139 + 2000
          = 222139

  bucket11 = 262*11 + 16*805
          = 2882 + 12880
          = 15762

  bucket12 = 16*11
          = 176

Raw buckets:
  [127800, 150972, 280482, 425219, 551071, 936354, 586851, 845441, 445773, 718440, 222139, 15762, 176]

PHASE 3) Carrying (make each bucket < 1000)
Rule: if bucket = carry*1000 + digit, keep digit and add carry to next bucket.

  bucket0=127800 -> carry=127, digit=800
    bucket0=800
    bucket1=150972+127=151099

  bucket1=151099 -> carry=151, digit=99
    bucket1=99
    bucket2=280482+151=280633

  bucket2=280633 -> carry=280, digit=633
    bucket2=633
    bucket3=425219+280=425499

  bucket3=425499 -> carry=425, digit=499
    bucket3=499
    bucket4=551071+425=551496

  bucket4=551496 -> carry=551, digit=496
    bucket4=496
    bucket5=936354+551=936905

  bucket5=936905 -> carry=936, digit=905
    bucket5=905
    bucket6=586851+936=587787

  bucket6=587787 -> carry=587, digit=787
    bucket6=787
    bucket7=845441+587=846028

  bucket7=846028 -> carry=846, digit=28
    bucket7=28
    bucket8=445773+846=446619

  bucket8=446619 -> carry=446, digit=619
    bucket8=619
    bucket9=718440+446=718886

  bucket9=718886 -> carry=718, digit=886
    bucket9=886
    bucket10=222139+718=222857

  bucket10=222857 -> carry=222, digit=857
    bucket10=857
    bucket11=15762+222=15984

  bucket11=15984 -> carry=15, digit=984
    bucket11=984
    bucket12=176+15=191

  bucket12=191 -> carry=0, digit=191
    bucket12=191
    top=0

Final chunks (left to right):
  191 | 984 | 857 | 886 | 619 | 28 | 787 | 905 | 496 | 499 | 633 | 99 | 800

PHASE 4) Recombine (pad chunks to 3 digits except the first)
  191984857886619028787905496499633099800

Answer:
  16262839261427117426 * 11805125464283272300 = 
\box{191984857886619028787905496499633099800}


============================================================
AI RESPONSE
============================================================

Let's analyze the provided multiplication transcript step by step to determine if there are any errors.

### Step 1: Chunk Splitting
**A Chunks**: 426, 117, 427, 261, 839, 262, 16  
**B Chunks**: 300, 272, 283, 464, 125, 805, 11  

The chunks have been split from right to left as expected, and the chunk sizes are correctly set at three digits. This part is correct.

### Step 2: Convolution (Bucket Calculations)

Now we need to verify each of the bucket calculations:

- **bucket0 = 426 * 300 = 127800**
  - **Correct**

- **bucket1 = 426 * 272 + 117 * 300 = 115872 + 35100 = 150972**
  - **Correct**

- **bucket2 = 426 * 283 + 117 * 272 + 427 * 300 = 120558 + 31824 + 128100 = 280482**
  - **Correct**

- **bucket3 = 426 * 464 + 117 * 283 + 427 * 272 + 261 * 300 = 197664 + 33111 + 116144 + 78300 = 425219**
  - **Correct**

- **bucket4 = 426 * 125 + 117 * 464 + 427 * 283 + 261 * 272 + 839 * 300 = 53250 + 54288 + 120841 + 70992 + 251700 = 551071**
  - **Correct**

- **bucket5 = 426 * 805 + 117 * 125 + 427 * 464 + 261 * 283 + 839 * 272 + 262 * 300 = 342930 + 14625 + 198128 + 73863 + 228208 + 78600 = 936354**
  - **Correct**

- **bucket6 = 426 * 11 + 117 * 805 + 427 * 125 + 261 * 464 + 839 * 283 + 262 * 272 + 16 * 300 = 4686 + 94185 + 53375 + 121104 + 237437 + 71264 + 4800 = 586851**
  - **Correct**

- **bucket7 = 117 * 11 + 427 * 805 + 261 * 125 + 839 * 464 + 262 * 283 + 16 * 272 = 1287 + 343735 + 32625 + 389296 + 74146 + 4352 = 845441**
  - **Correct**

- **bucket8 = 427 * 11 + 261 * 805 + 839 * 125 + 262 * 464 + 16 * 283 = 4697 + 210105 + 104875 + 121568 + 4528 = 445773**
  - **Correct**

- **bucket9 = 261 * 11 + 839 * 805 + 262 * 125 + 16 * 464 = 2871 + 675395 + 32750 + 7424 = 718440**
  - **Correct**

- **bucket10 = 839 * 11 + 262 * 805 + 16 * 125 = 9229 + 210910 + 2000 = 222139**
  - **Correct**

- **bucket11 = 262 * 11 + 16 * 805 = 2882 + 12880 = 15762**
  - **Correct**

- **bucket12 = 16 * 11 = 176**
  - **Correct**

All buckets appear to be calculated correctly.

### Step 3: Carrying Steps
Now let’s check the carrying steps:

1. bucket0=127800: carry=127, digit=800 → bucket1 updated to 151099.
   - **Correct**

2. bucket1=151099: carry=151, digit=99 → bucket2 updated to 280633.
   - **Correct**

3. bucket2=280633: carry=280, digit=633 → bucket3 updated to 425499.
   - **Correct**

4. bucket3=425499: carry=425, digit=499 → bucket4 updated to 551496.
   - **Correct**

5. bucket4=551496: carry=551, digit=496 → bucket5 updated to 936905.
   - **Correct**

6. bucket5=936905: carry=936, digit=905 → bucket6 updated to 587787.
   - **Correct**

7. bucket6=587787: carry=587, digit=787 → bucket7 updated to 846028.
   - **Correct**

8. bucket7=846028: carry=846, digit=28 → bucket8 updated to 446619.
   - **Correct**

9. bucket8=446619: carry=446, digit=619 → bucket9 updated to 718886.
   - **Correct**

10. bucket9=718886: carry=718, digit=886 → bucket10 updated to 222857.
    - **Correct**

11. bucket10=222857: carry=222, digit=857 → bucket11 updated to 15984.
    - **Correct**

12. bucket11=15984: carry=15, digit=984 → bucket12 updated to 191.
    - **Correct**

13. bucket12=191: carry=0, digit=191
    - **Correct**

All carrying steps have been executed correctly.

### Step 4: Final Recombination
The final chunks recombined are:
```
191 | 984 | 857 | 886 | 619 | 28 | 787 | 905 | 496 | 499 | 633 | 99 | 800
```
This results in:
```
191984857886619028787905496499633099800
```

### Correct Answer Verification
Now we need to see if this matches the calculated answer:
```
16262839261427117426 * 11805125464283272300 = 
\box{191984857886619028787905496499633099800}
```
Since it matches, we conclude this transcript is correct.

### Final Verdict:
\(\boxed{\text{correct}}\)
