============================================================
METADATA
============================================================

Model: gpt-4o-mini
Bits: 32
Transcript type: real
P: 2830315201
Q: 3569236949
Ground truth: correct
Model classification: correct
Correct classification: True


============================================================
TRANSCRIPT
============================================================

2830315201 x 3569236949
A=2830315201
B=3569236949

Chunked multiplication (chunk size = 3 digits, BASE = 1000)

PHASE 1) Split into 3-digit chunks (right to left)
  A chunks: 201, 315, 830, 2
  B chunks: 949, 236, 569, 3

PHASE 2) Convolution: multiply every chunk of A with every chunk of B; put each product into bucket (i+j), where i and j are the chunk distances from the right; add within buckets, no carrying yet.

  bucket0 = 201*949
          = 190749

  bucket1 = 201*236 + 315*949
          = 47436 + 298935
          = 346371

  bucket2 = 201*569 + 315*236 + 830*949
          = 114369 + 74340 + 787670
          = 188709 + 787670
          = 976379

  bucket3 = 201*3 + 315*569 + 830*236 + 2*949
          = 603 + 179235 + 195880 + 1898
          = 179838 + 195880 + 1898
          = 375718 + 1898
          = 377616

  bucket4 = 315*3 + 830*569 + 2*236
          = 945 + 472270 + 472
          = 473215 + 472
          = 473687

  bucket5 = 830*3 + 2*569
          = 2490 + 1138
          = 3628

  bucket6 = 2*3
          = 6

Raw buckets:
  [190749, 346371, 976379, 377616, 473687, 3628, 6]

PHASE 3) Carrying (make each bucket < 1000)
Rule: if bucket = carry*1000 + digit, keep digit and add carry to next bucket.

  bucket0=190749 -> carry=190, digit=749
    bucket0=749
    bucket1=346371+190=346561

  bucket1=346561 -> carry=346, digit=561
    bucket1=561
    bucket2=976379+346=976725

  bucket2=976725 -> carry=976, digit=725
    bucket2=725
    bucket3=377616+976=378592

  bucket3=378592 -> carry=378, digit=592
    bucket3=592
    bucket4=473687+378=474065

  bucket4=474065 -> carry=474, digit=65
    bucket4=65
    bucket5=3628+474=4102

  bucket5=4102 -> carry=4, digit=102
    bucket5=102
    bucket6=6+4=10

  bucket6=10 -> carry=0, digit=10
    bucket6=10
    top=0

Final chunks (left to right):
  10 | 102 | 65 | 592 | 725 | 561 | 749

PHASE 4) Recombine (pad chunks to 3 digits except the first)
  10102065592725561749

Answer:
  2830315201 * 3569236949 = 
\box{10102065592725561749}


============================================================
AI RESPONSE
============================================================

Let’s carefully analyze each phase of the multiplication process step by step to determine if there are any errors.

### PHASE 1: Chunking
- A chunks: [201, 315, 830, 2]
- B chunks: [949, 236, 569, 3]

The chunks are split correctly. Each number is divided into 3-digit groups from right to left.

### PHASE 2: Convolution (Bucket Calculations)

**bucket0:**
- Calculation: 201 * 949 = 190749
- This is correct.

**bucket1:**
- Calculation: 201 * 236 + 315 * 949
  - 201 * 236 = 47436
  - 315 * 949 = 298935
- Sum: 47436 + 298935 = 346371
- This is correct.

**bucket2:**
- Calculation: 201 * 569 + 315 * 236 + 830 * 949
  - 201 * 569 = 114369
  - 315 * 236 = 74340
  - 830 * 949 = 787670
- Step: 114369 + 74340 + 787670 = 976379 (summing the intermediate results)
- This calculation is correct.

**bucket3:**
- Calculation: 201 * 3 + 315 * 569 + 830 * 236 + 2 * 949
  - 201 * 3 = 603
  - 315 * 569 = 179235
  - 830 * 236 = 195880
  - 2 * 949 = 1898
- Step: 603 + 179235 + 195880 + 1898 = 377616
- This calculation is also correct.

**bucket4:**
- Calculation: 315 * 3 + 830 * 569 + 2 * 236
  - 315 * 3 = 945
  - 830 * 569 = 472270
  - 2 * 236 = 472
- Step: 945 + 472270 + 472 = 473687
- This calculation is correct.

**bucket5:**
- Calculation: 830 * 3 + 2 * 569
  - 830 * 3 = 2490
  - 2 * 569 = 1138
- Step: 2490 + 1138 = 3628
- This calculation is correct.

**bucket6:**
- Calculation: 2 * 3 = 6
- This calculation is also correct.

**Raw buckets:**
- [190749, 346371, 976379, 377616, 473687, 3628, 6] 

### PHASE 3: Carrying Steps

1. **For bucket0:** 
   - bucket0=190749 -> carry=190, digit=749
   - New bucket values: bucket0=749, bucket1=346371+190=346561 (This step is correct.)

2. **For bucket1:**
   - bucket1=346561 -> carry=346, digit=561
   - New values: bucket1=561, bucket2=976379+346=976725 (This step is correct.)

3. **For bucket2:**
   - bucket2=976725 -> carry=976, digit=725
   - New values: bucket2=725, bucket3=377616+976=378592 (This step is correct.)

4. **For bucket3:**
   - bucket3=378592 -> carry=378, digit=592
   - New values: bucket3=592, bucket4=473687+378=474065 (This step is correct.)

5. **For bucket4:**
   - bucket4=474065 -> carry=474, digit=65
   - New values: bucket4=65, bucket5=3628+474=4102 (This step is correct.)

6. **For bucket5:**
   - bucket5=4102 -> carry=4, digit=102
   - New values: bucket5=102, bucket6=6+4=10 (This step is correct.)

7. **For bucket6:**
   - bucket6=10 -> carry=0, digit=10
   - New values: bucket6=10, top=0 (This step is correct.)

### PHASE 4: Final recombine
Final chunks (left to right): 10 | 102 | 65 | 592 | 725 | 561 | 749

- Padded concatenation gives: 10102065592725561749.

### Conclusion

To verify:
- The final result of \( 2830315201 \times 3569236949 \) is to be checked against the calculated answer.
  
Finding the true product:
\( 2830315201 \times 3569236949 = 10102065592725561749 \).

Since both the calculated and the product matched, the process is indeed correct.

Thus, the overall verdict is \(\boxed{correct}\).
