============================================================
METADATA
============================================================

Model: gpt-4.1
Bits: 64
Transcript type: fake
P: 16148790291981301956
Q: 12734485675842467375
Ground truth: incorrect
Model classification: incorrect
Correct classification: True

Fake transcript info:
  Claimed product: 205646538655419786093242451307953685500
  Real a: 35324334789297472135
  Real b: 28047507519026677554
  Real product: 990759545607436497282961044999944957790


============================================================
TRANSCRIPT
============================================================

16148790291981301956 x 12734485675842467375
A=16148790291981301956
B=12734485675842467375

Chunked multiplication (chunk size = 3 digits, BASE = 1000)

PHASE 1) Split into 3-digit chunks (right to left)
  A chunks: 135, 472, 297, 789, 334, 324, 35
  B chunks: 554, 677, 26, 519, 507, 47, 28

PHASE 2) Convolution: multiply every chunk of A with every chunk of B; put each product into bucket (i+j), where i and j are the chunk distances from the right; add within buckets, no carrying yet.

  bucket0 = 135*554
          = 74790

  bucket1 = 135*677 + 472*554
          = 91395 + 261488
          = 352883

  bucket2 = 135*26 + 472*677 + 297*554
          = 3510 + 319544 + 164538
          = 323054 + 164538
          = 487592

  bucket3 = 135*519 + 472*26 + 297*677 + 789*554
          = 70065 + 12272 + 201069 + 437106
          = 82337 + 201069 + 437106
          = 283406 + 437106
          = 720512

  bucket4 = 135*507 + 472*519 + 297*26 + 789*677 + 334*554
          = 68445 + 244968 + 7722 + 534153 + 185036
          = 313413 + 7722 + 534153 + 185036
          = 321135 + 534153 + 185036
          = 855288 + 185036
          = 1040324

  bucket5 = 135*47 + 472*507 + 297*519 + 789*26 + 334*677 + 324*554
          = 6345 + 239304 + 154143 + 20514 + 226118 + 179496
          = 245649 + 154143 + 20514 + 226118 + 179496
          = 399792 + 20514 + 226118 + 179496
          = 420306 + 226118 + 179496
          = 646424 + 179496
          = 825920

  bucket6 = 135*28 + 472*47 + 297*507 + 789*519 + 334*26 + 324*677 + 35*554
          = 3780 + 22184 + 150579 + 409491 + 8684 + 219348 + 19390
          = 25964 + 150579 + 409491 + 8684 + 219348 + 19390
          = 176543 + 409491 + 8684 + 219348 + 19390
          = 586034 + 8684 + 219348 + 19390
          = 594718 + 219348 + 19390
          = 814066 + 19390
          = 833456

  bucket7 = 472*28 + 297*47 + 789*507 + 334*519 + 324*26 + 35*677
          = 13216 + 13959 + 400023 + 173346 + 8424 + 23695
          = 27175 + 400023 + 173346 + 8424 + 23695
          = 427198 + 173346 + 8424 + 23695
          = 600544 + 8424 + 23695
          = 608968 + 23695
          = 632663

  bucket8 = 297*28 + 789*47 + 334*507 + 324*519 + 35*26
          = 8316 + 37083 + 169338 + 168156 + 910
          = 45399 + 169338 + 168156 + 910
          = 214737 + 168156 + 910
          = 382893 + 910
          = 383803

  bucket9 = 789*28 + 334*47 + 324*507 + 35*519
          = 22092 + 15698 + 164268 + 18165
          = 37790 + 164268 + 18165
          = 202058 + 18165
          = 220223

  bucket10 = 334*28 + 324*47 + 35*507
          = 9352 + 15228 + 17745
          = 24580 + 17745
          = 42325

  bucket11 = 324*28 + 35*47
          = 9072 + 1645
          = 10717

  bucket12 = 35*28
          = 980

Raw buckets:
  [74790, 352883, 487592, 720512, 1040324, 825920, 833456, 632663, 383803, 220223, 42325, 10717, 980]

PHASE 3) Carrying (make each bucket < 1000)
Rule: if bucket = carry*1000 + digit, keep digit and add carry to next bucket.

  bucket0=74790 -> carry=74, digit=790
    bucket0=790
    bucket1=352883+74=352957

  bucket1=352957 -> carry=352, digit=957
    bucket1=957
    bucket2=487592+352=487944

  bucket2=487944 -> carry=487, digit=944
    bucket2=944
    bucket3=720512+487=720999

  bucket3=720999 -> carry=720, digit=999
    bucket3=999
    bucket4=1040324+720=1041044

  bucket4=1041044 -> carry=1041, digit=44
    bucket4=44
    bucket5=825920+1041=826961

  bucket5=826961 -> carry=826, digit=961
    bucket5=961
    bucket6=833456+826=834282

  bucket6=834282 -> carry=834, digit=282
    bucket6=282
    bucket7=632663+834=633497

  bucket7=633497 -> carry=633, digit=497
    bucket7=497
    bucket8=383803+633=384436

  bucket8=384436 -> carry=384, digit=436
    bucket8=436
    bucket9=220223+384=220607

  bucket9=220607 -> carry=220, digit=607
    bucket9=607
    bucket10=42325+220=42545

  bucket10=42545 -> carry=42, digit=545
    bucket10=545
    bucket11=10717+42=10759

  bucket11=10759 -> carry=10, digit=759
    bucket11=759
    bucket12=980+10=990

  bucket12=990 -> carry=0, digit=990
    bucket12=990
    top=0

Final chunks (left to right):
  205 | 646 | 538 | 655 | 419 | 786 | 93 | 242 | 451 | 307 | 953 | 685 | 500

PHASE 4) Recombine (pad chunks to 3 digits except the first)
  205646538655419786093242451307953685500

Answer:
  16148790291981301956 * 12734485675842467375 = 
\box{205646538655419786093242451307953685500}


============================================================
AI RESPONSE
============================================================

Let's analyze the multiplication transcript step by step to check for any errors.

---

### PHASE 1: CHUNKING

Given:
- A = 16148790291981301956
- B = 12734485675842467375
- Chunk size: 3 digits, BASE = 1000

#### Let's check chunking, right to left.

**A Chunks:**  
A = 16148790291981301956

Divide A into 3-digit chunks from the right:
- 01956 → 956
- 301 → 301
- 813 → 813
- 991 → 991
- 902 → 902
- 487 → 487
- 161 → 161

Wait: Let's actually check the number of digits and chunks.
- 16148790291981301956:  
Let’s reverse:
- 6
- 5
- 9
- 1
- 0
- 1
- 3
- 8
- 1
- 9
- 1
- 9
- 2
- 0
- 9
- 8
- 7
- 4
- 1
- 6

Now, chunk from right to left:
- 956 (last 3)
- 019 (next 3)
- 813 (next 3)
- 991 (next 3)
- 902 (next 3)
- 487 (next 3)
- 161 (leftover, up front)

That gives:
- [16, 148, 790, 291, 981, 301, 956] — this doesn’t match.

Alternatively, let's do it more systematically:
Start from the end:
- 956
- 195
- 013
- 819
- 991
- 290
- 748
- 761

Wait, the transcript claims:
**A chunks:** 135, 472, 297, 789, 334, 324, 35

Let’s verify:

Divide 16148790291981301956 by 1000 repeatedly:

1. 16148790291981301956 / 1000 = 16148790291981301, remainder: 956  
2. 16148790291981301 / 1000 = 16148790291981, remainder: 301  
3. 16148790291981 / 1000 = 16148790291, remainder: 981  
4. 16148790291 / 1000 = 16148790, remainder: 291  
5. 16148790 / 1000 = 16148, remainder: 790  
6. 16148 / 1000 = 16, remainder: 148  
7. 16 / 1000 = 0, remainder: 16

So right-to-left chunks: 956, 301, 981, 291, 790, 148, 16  
But the transcript gives: 135, 472, 297, 789, 334, 324, 35

**Already, the chunking is incorrect.**  
Let's check B as well.

#### Check B chunking

B = 12734485675842467375

1. 12734485675842467375 / 1000 = 12734485675842467, remainder: 375  
2. 12734485675842467 / 1000 = 12734485675842, remainder: 467  
3. 12734485675842 / 1000 = 12734485675, remainder: 842  
4. 12734485675 / 1000 = 12734485, remainder: 675  
5. 12734485 / 1000 = 12734, remainder: 485  
6. 12734 / 1000 = 12, remainder: 734  
7. 12 / 1000 = 0, remainder: 12

Chunks right to left:
- 375, 467, 842, 675, 485, 734, 12

But transcript gives: 554, 677, 26, 519, 507, 47, 28

**This does not match.**

---

### PHASE 1 CONCLUSION

- Transcript claims chunking:
  - A: 135, 472, 297, 789, 334, 324, 35
  - B: 554, 677, 26, 519, 507, 47, 28

But correct chunking should be:
- A: 956, 301, 981, 291, 790, 148, 16
- B: 375, 467, 842, 675, 485, 734, 12

Thus, the transcript's chunking is incorrect, so all subsequent calculations, including convolutions, will be wrong as well.

---

### PHASES 2, 3, 4

Since the chunking is wrong, *all subsequent calculations are invalid* even if bucket/carry/combination steps follow correctly by rules—the initial step is already erroneous.

---

## FINAL VERDICT

\box{incorrect}

The step-by-step multiplication is incorrect due to the wrong chunking of the original numbers. All following calculations are thus invalid.
