============================================================
METADATA
============================================================

Model: gpt-4.1-nano
Bits: 32
Transcript type: real
P: 3334820472
Q: 3369350844
Ground truth: correct
Model classification: correct
Correct classification: True


============================================================
TRANSCRIPT
============================================================

3334820472 x 3369350844
A=3334820472
B=3369350844

Chunked multiplication (chunk size = 3 digits, BASE = 1000)

PHASE 1) Split into 3-digit chunks (right to left)
  A chunks: 472, 820, 334, 3
  B chunks: 844, 350, 369, 3

PHASE 2) Convolution: multiply every chunk of A with every chunk of B; put each product into bucket (i+j), where i and j are the chunk distances from the right; add within buckets, no carrying yet.

  bucket0 = 472*844
          = 398368

  bucket1 = 472*350 + 820*844
          = 165200 + 692080
          = 857280

  bucket2 = 472*369 + 820*350 + 334*844
          = 174168 + 287000 + 281896
          = 461168 + 281896
          = 743064

  bucket3 = 472*3 + 820*369 + 334*350 + 3*844
          = 1416 + 302580 + 116900 + 2532
          = 303996 + 116900 + 2532
          = 420896 + 2532
          = 423428

  bucket4 = 820*3 + 334*369 + 3*350
          = 2460 + 123246 + 1050
          = 125706 + 1050
          = 126756

  bucket5 = 334*3 + 3*369
          = 1002 + 1107
          = 2109

  bucket6 = 3*3
          = 9

Raw buckets:
  [398368, 857280, 743064, 423428, 126756, 2109, 9]

PHASE 3) Carrying (make each bucket < 1000)
Rule: if bucket = carry*1000 + digit, keep digit and add carry to next bucket.

  bucket0=398368 -> carry=398, digit=368
    bucket0=368
    bucket1=857280+398=857678

  bucket1=857678 -> carry=857, digit=678
    bucket1=678
    bucket2=743064+857=743921

  bucket2=743921 -> carry=743, digit=921
    bucket2=921
    bucket3=423428+743=424171

  bucket3=424171 -> carry=424, digit=171
    bucket3=171
    bucket4=126756+424=127180

  bucket4=127180 -> carry=127, digit=180
    bucket4=180
    bucket5=2109+127=2236

  bucket5=2236 -> carry=2, digit=236
    bucket5=236
    bucket6=9+2=11

  bucket6=11 -> carry=0, digit=11
    bucket6=11
    top=0

Final chunks (left to right):
  11 | 236 | 180 | 171 | 921 | 678 | 368

PHASE 4) Recombine (pad chunks to 3 digits except the first)
  11236180171921678368

Answer:
  3334820472 * 3369350844 = 
\box{11236180171921678368}


============================================================
AI RESPONSE
============================================================

Let's analyze the transcript step by step.

**Step 1: Checking the chunk split (correctness of the chunks)**  
Numbers:  
A = 3334820472  
B = 3369350844

Chunks are taken from right to left in groups of 3 digits:

- A chunks: 472, 820, 334, 3  
  Number: 3 334 820 472  
  Confirm: 3,334,820,472 matches A. Correct.

- B chunks: 844, 350, 369, 3  
  Number: 3 369 350 844  
  Confirm: 3,369,350,844 matches B. Correct.

**Chunk split is correct.**

---

**Step 2: Validity of the convolution calculation (multiplying each pair of chunks)**

The calculation of each bucket involves multiplying chunks and summing partial products:

- bucket0: 472*844 = 398,368  
  Correct.

- bucket1: 472*350 + 820*844  
  = 165,200 + 692,080 = 857,280  
  Correct.

- bucket2: 472*369 + 820*350 + 334*844  
  = 174,168 + 287,000 + 281,896 = 743,064  
  Confirmed as: 174,168 + 287,000 = 461,168; +281,896 = 743,064  
  Correct.

- bucket3: 472*3 + 820*369 + 334*350 + 3*844  
  = 1,416 + 302,580 + 116,900 + 2,532  
  Total: 1,416 + 302,580 = 303,996; +116,900=420,896; +2,532=423,428  
  Correct.

- bucket4: 820*3 + 334*369 + 3*350  
  = 2,460 + 123,246 + 1,050  
  Total: 125,706 + 1,050=126,756  
  Correct.

- bucket5: 334*3 + 3*369  
  = 1,002 + 1,107= 2,109  
  Correct.

- bucket6: 3*3= 9  
  Correct.

Convolution buckets are correct.

---

**Step 3: Carrying over**

Carry operation (bucket < 1000):

- bucket0: 398,368  
  carry=398, digit=368  
  bucket0=368  
  bucket1=857,280 + 398=857,678

- bucket1: 857,678  
  carry=857, digit=678  
  bucket1=678  
  bucket2=743,064 +857=743,921

- bucket2: 743,921  
  carry=743, digit=921  
  bucket2=921  
  bucket3=424,171

- bucket3: 424,171  
  carry=424, digit=171  
  bucket3=171  
  bucket4=127,180

- bucket4: 127,180  
  carry=127, digit=180  
  bucket4=180  
  bucket5=2,109+127=2,236

- bucket5: 2,236  
  carry=2, digit=236  
  bucket5=236  
  bucket6=11

- bucket6: 11  
  carry=0, digit=11

All carry steps are accurate.

Final buckets after carry:  
11, 236, 180, 171, 921, 678, 368

---

**Step 4: Recombination**

The final number is reconstructed as:  
11|236|180|171|921|678|368

This is "11236180171921678368" (articulated as concatenation).  
This appears to correctly assemble the chunks.

---

**Step 5: Final verification**

Let's check whether the product of A and B indeed equal 11236180171921678368:

- The product is computed using chunked operation. Given all steps are consistent, and the arithmetic is verified at each step, the resulting number aligns with the method.

- The final answer matches the standard method: the chunks, convolution, carrying, and recombination seem correct.

**No errors detected in any step.**

---

### Final verdict:

\(\boxed{\text{correct}}\)
