============================================================
METADATA
============================================================

Model: gpt-4.1-nano
Bits: 64
Transcript type: fake
P: 15304031206031000454
Q: 10795080376454315321
Ground truth: incorrect
Model classification: incorrect
Correct classification: True

Fake transcript info:
  Claimed product: 165208246952869721698584481811210155734
  Real a: 93604948131275607602
  Real b: 40303620164111727487
  Real product: 3772618274964311943214791656469769556174


============================================================
TRANSCRIPT
============================================================

15304031206031000454 x 10795080376454315321
A=15304031206031000454
B=10795080376454315321

Chunked multiplication (chunk size = 3 digits, BASE = 1000)

PHASE 1) Split into 3-digit chunks (right to left)
  A chunks: 602, 607, 275, 131, 948, 604, 93
  B chunks: 487, 727, 111, 164, 620, 303, 40

PHASE 2) Convolution: multiply every chunk of A with every chunk of B; put each product into bucket (i+j), where i and j are the chunk distances from the right; add within buckets, no carrying yet.

  bucket0 = 602*487
          = 293174

  bucket1 = 602*727 + 607*487
          = 437654 + 295609
          = 733263

  bucket2 = 602*111 + 607*727 + 275*487
          = 66822 + 441289 + 133925
          = 508111 + 133925
          = 642036

  bucket3 = 602*164 + 607*111 + 275*727 + 131*487
          = 98728 + 67377 + 199925 + 63797
          = 166105 + 199925 + 63797
          = 366030 + 63797
          = 429827

  bucket4 = 602*620 + 607*164 + 275*111 + 131*727 + 948*487
          = 373240 + 99548 + 30525 + 95237 + 461676
          = 472788 + 30525 + 95237 + 461676
          = 503313 + 95237 + 461676
          = 598550 + 461676
          = 1060226

  bucket5 = 602*303 + 607*620 + 275*164 + 131*111 + 948*727 + 604*487
          = 182406 + 376340 + 45100 + 14541 + 689196 + 294148
          = 558746 + 45100 + 14541 + 689196 + 294148
          = 603846 + 14541 + 689196 + 294148
          = 618387 + 689196 + 294148
          = 1307583 + 294148
          = 1601731

  bucket6 = 602*40 + 607*303 + 275*620 + 131*164 + 948*111 + 604*727 + 93*487
          = 24080 + 183921 + 170500 + 21484 + 105228 + 439108 + 45291
          = 208001 + 170500 + 21484 + 105228 + 439108 + 45291
          = 378501 + 21484 + 105228 + 439108 + 45291
          = 399985 + 105228 + 439108 + 45291
          = 505213 + 439108 + 45291
          = 944321 + 45291
          = 989612

  bucket7 = 607*40 + 275*303 + 131*620 + 948*164 + 604*111 + 93*727
          = 24280 + 83325 + 81220 + 155472 + 67044 + 67611
          = 107605 + 81220 + 155472 + 67044 + 67611
          = 188825 + 155472 + 67044 + 67611
          = 344297 + 67044 + 67611
          = 411341 + 67611
          = 478952

  bucket8 = 275*40 + 131*303 + 948*620 + 604*164 + 93*111
          = 11000 + 39693 + 587760 + 99056 + 10323
          = 50693 + 587760 + 99056 + 10323
          = 638453 + 99056 + 10323
          = 737509 + 10323
          = 747832

  bucket9 = 131*40 + 948*303 + 604*620 + 93*164
          = 5240 + 287244 + 374480 + 15252
          = 292484 + 374480 + 15252
          = 666964 + 15252
          = 682216

  bucket10 = 948*40 + 604*303 + 93*620
          = 37920 + 183012 + 57660
          = 220932 + 57660
          = 278592

  bucket11 = 604*40 + 93*303
          = 24160 + 28179
          = 52339

  bucket12 = 93*40
          = 3720

Raw buckets:
  [293174, 733263, 642036, 429827, 1060226, 1601731, 989612, 478952, 747832, 682216, 278592, 52339, 3720]

PHASE 3) Carrying (make each bucket < 1000)
Rule: if bucket = carry*1000 + digit, keep digit and add carry to next bucket.

  bucket0=293174 -> carry=293, digit=174
    bucket0=174
    bucket1=733263+293=733556

  bucket1=733556 -> carry=733, digit=556
    bucket1=556
    bucket2=642036+733=642769

  bucket2=642769 -> carry=642, digit=769
    bucket2=769
    bucket3=429827+642=430469

  bucket3=430469 -> carry=430, digit=469
    bucket3=469
    bucket4=1060226+430=1060656

  bucket4=1060656 -> carry=1060, digit=656
    bucket4=656
    bucket5=1601731+1060=1602791

  bucket5=1602791 -> carry=1602, digit=791
    bucket5=791
    bucket6=989612+1602=991214

  bucket6=991214 -> carry=991, digit=214
    bucket6=214
    bucket7=478952+991=479943

  bucket7=479943 -> carry=479, digit=943
    bucket7=943
    bucket8=747832+479=748311

  bucket8=748311 -> carry=748, digit=311
    bucket8=311
    bucket9=682216+748=682964

  bucket9=682964 -> carry=682, digit=964
    bucket9=964
    bucket10=278592+682=279274

  bucket10=279274 -> carry=279, digit=274
    bucket10=274
    bucket11=52339+279=52618

  bucket11=52618 -> carry=52, digit=618
    bucket11=618
    bucket12=3720+52=3772

  bucket12=3772 -> carry=3, digit=772
    bucket12=772
    top=3

Final chunks (left to right):
  165 | 208 | 246 | 952 | 869 | 721 | 698 | 584 | 481 | 811 | 210 | 155 | 734

PHASE 4) Recombine (pad chunks to 3 digits except the first)
  165208246952869721698584481811210155734

Answer:
  15304031206031000454 * 10795080376454315321 = 
\box{165208246952869721698584481811210155734}


============================================================
AI RESPONSE
============================================================

Let's analyze the provided transcript step-by-step:

1. **Number splitting into chunks:**

- A = 15304031206031000454
- B = 10795080376454315321

Chunks are taken from right to left in 3-digit groups:

- For A: 602, 607, 275, 131, 948, 604, 93
- For B: 487, 727, 111, 164, 620, 303, 40

Let's verify correctness of splitting:

Number A (from right to left in 3-digit groups):

- 15304031206031000454

Splitting:

Rightmost 3 digits: 454
Next: 054 => 54 (but the log shows 602 as the first chunk, which is inconsistent)

Actually, the first chunk listed: 602, which would correspond to the last three digits, but from the number, last three digits are 454, not 602.

Similarly, the next chunks:

- The first chunk from the transcript is 602, which is inconsistent with the last three digits (which are 454).

Same applies for B: last digits are 521, but the chunk is 487, which does not match.

Observation: The chunks listed are not from the last 3 digits of the original number. The chunks appear to be taken starting from the right but are mismatched in the splitting process.

**Conclusion:** The chunks are inconsistent with the original numbers, indicating a potential error in the chunking step.

2. **Convolution (bucket calculation):**

The calculations for each bucket involve multiplying each chunk of A with each chunk of B based on their positions, and summing within buckets.

- Let's verify the first bucket:

  bucket0 = 602 * 487 = 293174 → Correct.

- bucket1:

  = 602*727 + 607*487
  = 437654 + 295609
  = 733263 → matches transcript.

Similarly, further bucket calculations seem consistent with the listed values, assuming the chunks are correct.

But since the chunks themselves appear invalid, these multiplicative calculations are based on incorrect chunks.

3. **Carrying step:**

The carry is performed correctly for each bucket, breaking down each bucket value into a single digit (less than 1000), and carrying over the excess to the next bucket in a proper manner.

The process shows proper carry propagation.

4. **Final recombination:**

After carries, the final chunks are:

165 | 208 | 246 | 952 | 869 | 721 | 698 | 584 | 481 | 811 | 210 | 155 | 734

which are then concatenated to produce the final answer:

165208246952869721698584481811210155734

---

**Key Point:** The core issue lies in the initial chunking: the chunks provided do NOT match the actual decimal decomposition of the original numbers into 3-digit groups. The entire convolution depends on properly split chunks, so if the chunks are incorrect, the resulting product is invalid.

Given that chunk extraction is inconsistent with the original numbers, the entire multiplication process based on these chunks is flawed.

---

### Final verdict:

**The error in chunk splitting invalidates the rest of the calculation.**

**Therefore, the multiplication process is incorrect.**

\(\boxed{\text{incorrect}}\)
